{
  "schema_version": "jd-match-report/0.1.0",
  "rubric_version": "jd-match-rubric/0.1.0",
  "case_id": "freshgrad-project-research",
  "synthetic": true,
  "private_markers": [
    "合成机构甲",
    "合成机构乙",
    "合成院校"
  ],
  "sources": [
    {
      "source_id": "src-resume-1",
      "kind": "resume",
      "filename": "resume.md",
      "summary": "合成简历，全部材料已提取，未含真实联系方式。",
      "parse_warnings": []
    },
    {
      "source_id": "src-jd-1",
      "kind": "jd",
      "filename": "jd-1.md",
      "summary": "合成目标岗位，要求与资格条件已拆解。",
      "parse_warnings": []
    },
    {
      "source_id": "src-jd-2",
      "kind": "jd",
      "filename": "jd-2.md",
      "summary": "合成目标岗位，要求与资格条件已拆解。",
      "parse_warnings": []
    }
  ],
  "candidate_stage": "fresh_grad",
  "parse_warnings": [],
  "jobs": [
    {
      "job_id": "job-1",
      "title": "数据分析助理",
      "category": "data",
      "jd_source_id": "src-jd-1",
      "score": 83,
      "scoring_status": "ok",
      "gates": [
        {
          "gate_id": "gate-1-1",
          "job_id": "job-1",
          "text": "本科及以上学历",
          "jd_quote": "必须本科及以上学历",
          "status": "met",
          "evidence_ids": [
            "ev-freshgrad-project-2"
          ],
          "rationale": "简历教育背景写有本科。"
        }
      ],
      "unknown_count": 1,
      "rank": 1,
      "rank_rationale": "按各自 JD 的证据覆盖比较，本岗位为本次主目标。",
      "suggestion": "prioritize",
      "suggestion_rationale": "先调整材料结构，再核对关键事实。现有行为与核心职责相关，缺少的结果口径保留待确认。"
    },
    {
      "job_id": "job-2",
      "title": "统计研究助理",
      "category": "data",
      "jd_source_id": "src-jd-2",
      "score": 75,
      "scoring_status": "ok",
      "unknown_count": 0,
      "rank": 2,
      "rank_rationale": "按各自 JD 的证据覆盖比较，本岗位为本次主目标。",
      "suggestion": "prioritize",
      "suggestion_rationale": "先调整材料结构，再核对关键事实。现有行为与核心职责相关，缺少的结果口径保留待确认。",
      "gates": [
        {
          "gate_id": "gate-2-1",
          "job_id": "job-2",
          "text": "本科及以上学历",
          "jd_quote": "必须本科及以上学历",
          "status": "met",
          "evidence_ids": [
            "ev-freshgrad-project-2"
          ],
          "rationale": "简历教育背景写有本科。"
        }
      ]
    }
  ],
  "requirements": [
    {
      "req_id": "req-1-1",
      "job_id": "job-1",
      "text": "熟练使用 SQL 清洗与汇总数据",
      "jd_quote": "熟练使用 SQL 清洗与汇总数据",
      "locator": "src-jd-1 L3",
      "category": "skill",
      "importance": "must",
      "importance_source": "jd_explicit",
      "status": "supported",
      "evidence_ids": [
        "ev-freshgrad-project-7"
      ],
      "answer_ids": [],
      "rationale": "岗位要求熟练使用 SQL 清洗与汇总数据；简历已有对应行为记录。",
      "weight": 3
    },
    {
      "req_id": "req-1-2",
      "job_id": "job-1",
      "text": "制作分析图表并撰写分析报告",
      "jd_quote": "制作分析图表并撰写分析报告",
      "locator": "src-jd-1 L4",
      "category": "experience",
      "importance": "normal",
      "importance_source": "system_default",
      "status": "supported",
      "evidence_ids": [
        "ev-freshgrad-project-8"
      ],
      "answer_ids": [],
      "rationale": "岗位要求制作分析图表并撰写分析报告；简历已有对应行为记录。",
      "weight": 2
    },
    {
      "req_id": "req-1-3",
      "job_id": "job-1",
      "text": "具有正式论文发表经历者优先",
      "jd_quote": "具有正式论文发表经历者优先",
      "locator": "src-jd-1 L5",
      "category": "experience",
      "importance": "bonus",
      "importance_source": "jd_explicit",
      "status": "unknown",
      "evidence_ids": [],
      "answer_ids": [],
      "rationale": "材料未提供可核对的实践证据，保留为未写清或待确认。",
      "weight": 1
    },
    {
      "req_id": "req-2-1",
      "job_id": "job-2",
      "text": "统计学专业课程背景优先",
      "jd_quote": "统计学专业课程背景优先",
      "locator": "src-jd-2 L3",
      "category": "skill",
      "importance": "bonus",
      "importance_source": "jd_explicit",
      "status": "supported",
      "evidence_ids": [
        "ev-freshgrad-project-2"
      ],
      "answer_ids": [],
      "rationale": "课程与报告提供相关证据；实践深度以材料中的描述为准。",
      "weight": 1
    },
    {
      "req_id": "req-2-2",
      "job_id": "job-2",
      "text": "掌握统计推断与实验设计方法",
      "jd_quote": "掌握统计推断与实验设计方法",
      "locator": "src-jd-2 L4",
      "category": "skill",
      "importance": "must",
      "importance_source": "jd_explicit",
      "status": "partial",
      "evidence_ids": [
        "ev-freshgrad-project-3",
        "ev-freshgrad-project-4"
      ],
      "answer_ids": [],
      "rationale": "课程与报告提供相关证据；实践深度以材料中的描述为准。",
      "weight": 3
    },
    {
      "req_id": "req-2-3",
      "job_id": "job-2",
      "text": "撰写统计方法说明与分析限制",
      "jd_quote": "撰写统计方法说明与分析限制",
      "locator": "src-jd-2 L5",
      "category": "skill",
      "importance": "normal",
      "importance_source": "system_default",
      "status": "supported",
      "evidence_ids": [
        "ev-freshgrad-project-4",
        "ev-freshgrad-project-9"
      ],
      "answer_ids": [],
      "rationale": "课程与报告提供相关证据；实践深度以材料中的描述为准。",
      "weight": 2
    }
  ],
  "evidence": [
    {
      "evidence_id": "ev-freshgrad-project-1",
      "source_id": "src-resume-1",
      "quote": "教育背景",
      "locator": "src-resume-1 L4",
      "tags": []
    },
    {
      "evidence_id": "ev-freshgrad-project-2",
      "source_id": "src-resume-1",
      "quote": "合成院校 · 统计学本科 · 2022.09–2026.06",
      "locator": "src-resume-1 L6",
      "tags": []
    },
    {
      "evidence_id": "ev-freshgrad-project-3",
      "source_id": "src-resume-1",
      "quote": "学习统计推断、实验设计与数据库课程",
      "locator": "src-resume-1 L7",
      "tags": []
    },
    {
      "evidence_id": "ev-freshgrad-project-4",
      "source_id": "src-resume-1",
      "quote": "课程研究中比较统计方法并撰写方法说明",
      "locator": "src-resume-1 L8",
      "tags": []
    },
    {
      "evidence_id": "ev-freshgrad-project-5",
      "source_id": "src-resume-1",
      "quote": "项目经历",
      "locator": "src-resume-1 L10",
      "tags": []
    },
    {
      "evidence_id": "ev-freshgrad-project-6",
      "source_id": "src-resume-1",
      "quote": "课程用户分析项目 · 数据处理成员 · 2025.09–2025.12",
      "locator": "src-resume-1 L12",
      "tags": []
    },
    {
      "evidence_id": "ev-freshgrad-project-7",
      "source_id": "src-resume-1",
      "quote": "使用 SQL 清洗课程样本并进行分组汇总",
      "locator": "src-resume-1 L13",
      "tags": []
    },
    {
      "evidence_id": "ev-freshgrad-project-8",
      "source_id": "src-resume-1",
      "quote": "制作用户行为分析图表并撰写分析报告",
      "locator": "src-resume-1 L14",
      "tags": []
    },
    {
      "evidence_id": "ev-freshgrad-project-9",
      "source_id": "src-resume-1",
      "quote": "根据样本分组结果整理指标定义和分析限制",
      "locator": "src-resume-1 L15",
      "tags": []
    },
    {
      "evidence_id": "ev-freshgrad-project-10",
      "source_id": "src-resume-1",
      "quote": "校园经历",
      "locator": "src-resume-1 L17",
      "tags": []
    },
    {
      "evidence_id": "ev-freshgrad-project-11",
      "source_id": "src-resume-1",
      "quote": "校园活动志愿者 · 2024.10",
      "locator": "src-resume-1 L19",
      "tags": []
    },
    {
      "evidence_id": "ev-freshgrad-project-12",
      "source_id": "src-resume-1",
      "quote": "协助现场签到和资料整理",
      "locator": "src-resume-1 L20",
      "tags": []
    }
  ],
  "answers": [],
  "primary_job_id": "job-2",
  "primary_selection_reason": "用户改选统计研究助理，重新生成主目标结构方案。",
  "answer_variants": [],
  "rewrites": [
    {
      "rewrite_id": "rw-1",
      "job_id": "job-2",
      "original_quote": "学习统计推断、实验设计与数据库课程",
      "rewritten_text": "课程学习覆盖统计推断、实验设计与数据库",
      "rationale": "把可核对的产出与具体行动放在句子前部，保留原职责及成果归属。",
      "new_facts": [],
      "numbers_from": [],
      "pending_fill": false
    },
    {
      "rewrite_id": "rw-2",
      "job_id": "job-2",
      "original_quote": "课程研究中比较统计方法并撰写方法说明",
      "rewritten_text": "撰写统计方法说明，并在课程研究中比较方法",
      "rationale": "把可核对的产出与具体行动放在句子前部，保留原职责及成果归属。",
      "new_facts": [],
      "numbers_from": [],
      "pending_fill": false
    },
    {
      "rewrite_id": "rw-3",
      "job_id": "job-2",
      "original_quote": "根据样本分组结果整理指标定义和分析限制",
      "rewritten_text": "依据样本分组结果说明分析限制，并整理指标定义",
      "rationale": "把可核对的产出与具体行动放在句子前部，保留原职责及成果归属。",
      "new_facts": [],
      "numbers_from": [],
      "pending_fill": false
    }
  ],
  "actions": [
    {
      "action_id": "act-1",
      "job_id": "job-2",
      "order": 1,
      "goal": "按岗位要求重排整份简历",
      "deliverable": "一版调整顺序的简历",
      "completion_criteria": "最相关的经历与条目已前移，任职信息仍完整。",
      "fact_or_skill": "fact"
    },
    {
      "action_id": "act-2",
      "job_id": "job-2",
      "order": 2,
      "goal": "核对本人贡献和成果归属",
      "deliverable": "一条有记录支持的本人贡献描述",
      "completion_criteria": "团队成果和个人贡献各有明确说明。",
      "fact_or_skill": "fact"
    },
    {
      "action_id": "act-3",
      "job_id": "job-2",
      "order": 3,
      "goal": "补齐尚未写清的事实",
      "deliverable": "可引用的交付记录或说明",
      "completion_criteria": "能指出记录出处；没有记录的部分仍标待确认。",
      "fact_or_skill": "fact"
    }
  ],
  "share_payload": {
    "standalone": true,
    "anonymized": true,
    "score": 75,
    "score_label": "简历证据匹配度",
    "job_title": "统计研究助理",
    "job_category": "data",
    "headline_findings": [
      "核心经历有行为证据，整份顺序需要对齐岗位。"
    ],
    "gate_notes": [
      "本科资格已在原文写明。"
    ],
    "disclaimer": "分数衡量简历证据对 JD 的覆盖，不代表能力总分、ATS 分或面试概率。"
  }
}
